<?xml version="1.0" encoding="iso-8859-1"?>
<?xml-stylesheet type="text/xsl" href="114_dogs.xsl"?>

<!--?xml-stylesheet href="113_dogs.css" type="text/css"?-->

<!DOCTYPE myDogs SYSTEM "111_dogs.dtd">

<myDogs>
<dog breed="Labrabor Retriever">
<name>Morgan</name>
<age>
<years>0</years>
<months>10</months>
</age>
<fullBlood>yes</fullBlood>
<color>chocolate</color>
</dog>
<dog breed="Labrador Retriever">
<name>Molly</name>
<age><years>8</years>
<months>11</months>
</age>
<fullBlood>yes</fullBlood>
<color>yellow</color>
</dog>
<dog breed="Pomeranian">
<name>Casey</name>
<age>
<years>6</years>
<months>2</months>
</age>
<fullBlood>yes</fullBlood>
<color>brown</color>
</dog>
</myDogs>